platform,text_content,date,keyword_used,category,source_url,country_context,location_geographic,sentiment_score,top_20_mapping
Google Search,"everything about ownership — serval pet breeders a african serval should be bred from two parents that don't spray, are kind with strangers, good with children and have no issues with anxiety.",2026-02-13,pet serval,Big Cat,https://www.servalcatforsale.com/everything-about-ownership,United States,National (US),-0.4168,
Google Search,what you need to know about adding a serval ... servals require a confident handler as you are the serval's foundation. in the time we've been raising our serval and conversing with other ...,2026-02-13,pet serval,Big Cat,https://www.savannahgans.com/blog-1/servalpet,United States,National (US),0.4939,
Google Search,"do serval cats make good house pets? although servals (a wild cat) are not included in the provincial controlled alien species legislation, that doesn't mean they should be kept as pets.",2026-02-13,pet serval,Big Cat,https://spca.bc.ca/faqs/do-serval-cats-make-good-house-pets/,United States,National (US),0.4404,
Google Search,"servals are not pets | big cat rescue | wild cats in the wild it is illegal to own a serval in california without a special permit. los angeles animal services is working to determine if the cat has an owner. june 21, 2019 ...",2026-02-13,pet serval,Big Cat,https://bigcatrescue.org/conservation-news/servals-not-pets,United States,National (US),-0.3732,Q4_Legal
Google Search,what's it like to own a serval cat in like a house? they are dangerous wild animals and should not be staying a home with humans. it's cruel for the cat and unsafe for you.,2026-02-13,pet serval,Big Cat,https://www.reddit.com/r/serval/comments/16wrt6m/whats_it_like_to_own_a_serval_cat_in_like_a_house/,United States,National (US),-0.4404,Q5_Safety
Google Search,"serval pet risk and care assessment this assessment explains the high risks of keeping a serval, including conservation concerns, health risks, and long-term care needs.",2026-02-13,pet serval,Big Cat,https://www.worldwildlife.org/our-work/wildlife/wildlife-crime/responsible-pet-guide/assessed-exotic-species/serval/,United States,National (US),0.2732,Q6_Welfare
Google Search,"servals: why they don't make good pets legal restrictions: in many places, it's illegal to own a serval as a pet due to their potential danger to humans and the exotic pet trade regulations.",2026-02-13,pet serval,Big Cat,https://carolinatigerrescue.org/education-blog/servals-why-they-dont-make-good-pets/,United States,National (US),-0.8362,"Q4_Legal, Q5_Safety"
Google Search,"what are the pros and cons of owning a serval as a pet? ... there are no pros to having a pet serval. the serval is a small, endangered wild cat. servals are no more suitable (i. e., not at all) as pets ...",2026-02-13,pet serval,Big Cat,https://www.quora.com/What-are-the-pros-and-cons-of-owning-a-serval-as-a-pet-Are-there-any-other-big-cats-that-can-be-owned-as-pets-in-the-United-States-or-is-it-only-lions-and-tigers,United States,National (US),-0.5267,Q5_Safety
Google Search,"anyone have the current laws on owning a serval by state? ... at the moment it is still legal to have a serval as a pet. ... here's the good news, looks like they may be an avenue to legal serval ownership.",2026-02-13,pet serval,Big Cat,https://www.facebook.com/groups/1777115215928548/posts/2868366986803360/,United States,National (US),0.7506,Q4_Legal
Google Search,"keeping primates as pets | rspca - rspca - rspca.org.uk primates are not suitable house pets. they need space, companions and mental stimulation, not what you find in someone's living room.",2026-02-13,pet macaque,Primate,https://www.rspca.org.uk/adviceandwelfare/pets/other/primates,United States,National (US),0.0,
Google Search,do primates make good pets? most primatologists and primatological organizations are strongly against keeping primates as pets. the reasons are numerous.,2026-02-13,pet macaque,Primate,https://primate.wisc.edu/primate-info-net/pin-factsheets/pin-factsheet-primates-as-pets/,United States,National (US),0.6124,
Google Search,primates as pets: by the numbers safety for both people and animals is compromised when primates are owned as pets. 11% – the percentage of pet primate deaths due to owners ...,2026-02-13,pet macaque,Primate,https://www.lpzoo.org/primates-as-pets-by-the-numbers/,United States,National (US),0.4215,
Google Search,10 compelling reasons to avoid a pet monkey primate pet ownership is sometimes either completely prohibited or necessitates the purchase of expensive licences. the jrc supports a worldwide ...,2026-02-13,pet macaque,Primate,https://www.jaguarrescue.foundation/en-us/News/ArticleID/44/10-Compelling-Reasons-to-Avoid-a-Pet-Monkey-A-Must-Read,United States,National (US),0.296,Q5_Safety
Google Search,legality of owning a monkey in the u.s. and canada [oc] the monkey is not spoiled. the woman is not capable of taking care of a wild animal. don't blame the monkey when the owner sucks.,2026-02-13,pet macaque,Primate,https://www.reddit.com/r/dataisbeautiful/comments/kg0b4o/legality_of_owning_a_monkey_in_the_us_and_canada/,United States,National (US),0.1411,Q6_Welfare
Google Search,the darwin saga: macaques as pets - worms & germs blog stress-associated health and behavioural problems are quite common in pet macaques. the lifespan of these monkeys also needs to be considered.,2026-02-13,pet macaque,Primate,https://www.wormsandgermsblog.com/2012/12/articles/animals/other-animals/the-darwin-saga-macaques-as-pets/,United States,National (US),-0.4019,
Google Search,"primate pet ownership fuels a brutal industry. this bill ... spider monkeys, like violeta, are now among the most-trafficked animals and are listed as endangered by the international union for conservation ...",2026-02-13,pet macaque,Primate,https://www.npr.org/2025/07/26/nx-s1-5463589/captive-primate-safety-act-exotic-pet-trade-illegal,United States,National (US),-0.3818,Q5_Safety
Google Search,"pet monkey in the united states, most states restrict monkey ownership, whether via licensing requirements or outright bans, but, as of 2016, 13 states allow it.",2026-02-13,pet macaque,Primate,https://en.wikipedia.org/wiki/Pet_monkey,United States,National (US),0.1055,
Google Search,"release of ex-pets release of ex-pet monkeys can be done successfully, with good welfare for released monkeys and minimal impact on the local environment and inhabitants.",2026-02-13,pet macaque,Primate,https://www.macaquecoalition.com/release-of-ex-pets,United States,National (US),0.7269,Q6_Welfare
Google Search,honest opinions on owning an axolotl? axolotls aren't boring. they can be very reactive to people once they are healthy and comfortable. they can be difficult if you're used to ...,2026-02-13,pet axolotl,Amphibian,https://www.reddit.com/r/axolotls/comments/113wjpz/honest_opinions_on_owning_an_axolotl/,United States,National (US),0.8299,
Google Search,"the ethics of axolotl ownership: what every potential ... in the united states, axolotl ownership is illegal in california, maine, new jersey, and virginia, while obtaining a permit in new mexico and ...",2026-02-13,pet axolotl,Amphibian,https://axolotlplanet.com/blogs/all-about-axolotls/the-ethics-of-axolotl-ownership-what-every-potential-owner-should-know,United States,National (US),-0.2023,Q4_Legal
Google Search,"axolotl pet risk assessment and care considerations check your local laws on exotic pet ownership. in the us, some states prohibit ownership of axolotls or require permits. axolotl dietary and water quality ...",2026-02-13,pet axolotl,Amphibian,https://www.worldwildlife.org/our-work/wildlife/wildlife-crime/responsible-pet-guide/assessed-exotic-species/axolotl/,United States,National (US),0.2732,"Q4_Legal, Q6_Welfare"
Google Search,"keeping and caring for axolotls as pets axolotls are illegal to own in some states, including california, maine, new jersey, and virginia. in new mexico, they are legal to own but ...",2026-02-13,pet axolotl,Amphibian,https://www.thesprucepets.com/axolotls-as-pets-1236714,United States,National (US),0.0129,Q4_Legal
Google Search,"responsible axolotl pet ownership and care ... is it legal to own? prior to purchasing an axolotl, you should speak with a representative from your state's agency. axolotls are legal most ...",2026-02-13,pet axolotl,Amphibian,https://www.facebook.com/groups/888040157965727/posts/8581385635297769/,United States,National (US),0.7579,Q6_Welfare
Google Search,"can you have an axolotl as a pet? axolotls are illegal or restricted in some states, including california, new jersey, and maine. regulations can change, so always confirm with ...",2026-02-13,pet axolotl,Amphibian,https://axolotlplanet.com/blogs/all-about-axolotls/can-you-have-an-axolotl-as-a-pet,United States,National (US),-0.7351,Q4_Legal
Google Search,"why are axolotls illegal to own in some states and ... in the united states, axolotls are illegal to own in california, maine, new jersey, and d.c., while a permit is required in new mexico and ...",2026-02-13,pet axolotl,Amphibian,https://www.axolotlcentral.com/post/why-are-axolotls-illegal-to-own-in-some-states-provinces,United States,National (US),-0.6597,Q4_Legal
Google Search,"essential axolotl care guide for new pet owners 2025 this guide will provide you with the fundamental insights into axolotl care, covering everything from the ideal tank setup to their dietary needs.",2026-02-13,pet axolotl,Amphibian,https://galenaanimal.com/axolotl-care/,United States,National (US),0.8689,Q6_Welfare
Google Search,"is it illegal to own an axolotl? it depends. axolotl demand now goes beyond pet owners, however. meister says animal traffickers are particularly attracted to them due to their “unique ...",2026-02-13,pet axolotl,Amphibian,https://www.popsci.com/environment/can-you-own-axolotl/,United States,National (US),-0.2516,Q4_Legal
Google Search,"a guide to caring for burmese pythons as pets they make fascinating pets for the right owner. however, they are not suitable for beginners and are generally best left in the wild. they are ...",2026-02-13,pet burmese python,Reptile,https://www.thesprucepets.com/burmese-pythons-as-pets-1237322,United States,National (US),0.8979,
Google Search,"thinking about getting a burmese python, any advice or ... he said they grow very slowly, unless you power feed them, and they will be a snake that you can grow with over the course of their life.",2026-02-13,pet burmese python,Reptile,https://www.reddit.com/r/snakes/comments/163ynlc/thinking_about_getting_a_burmese_python_any/,United States,National (US),0.0,
Google Search,"should i get a burmese python as a pet? burmese pythons are not suitable pets for everyone. their size, commitment, and potential dangers require a dedicated and responsible owner.",2026-02-13,pet burmese python,Reptile,https://bobclark.com/blogs/articles/should-i-get-a-burmese-python-as-a-pet,United States,National (US),0.5719,Q5_Safety
Google Search,what are the pros and cons of owning a burmese python ... all have great temperaments. tap training is very important they are food aggressive and babies can be a little bitey but that can be worked ...,2026-02-13,pet burmese python,Reptile,https://www.facebook.com/groups/morphmarket/posts/1906715223141872/,United States,National (US),0.4208,Q5_Safety
Google Search,"burmese python care this is at least a 20 year commitment and a hefty financial investment as well. picture. natural history ​burmese pythons are diurnal, rainforest dwelling ...",2026-02-13,pet burmese python,Reptile,http://www.exoticpetvet.com/burmese-python-care.html,United States,National (US),0.8591,Q6_Welfare
Google Search,"burmese pythons: cool or cruel husbandry is complex but manageable at first. at this age, the python requires live mice as food. a large 20 gallon aquarium should be maintained at 80 to 85.",2026-02-13,pet burmese python,Reptile,https://vet.purdue.edu/hospital/small-animal/primary-care/documents/BurmesePythons.pdf,United States,National (US),-0.1901,
Google Search,"should i get a burmese python as a pet? | ocala vet burmese pythons require a lot of care and maintenance and are expensive to feed and keep. in general, pythons are best left in the wild.",2026-02-13,pet burmese python,Reptile,https://www.paddockparkvet.com/site/blog/2022/04/15/should-burmese-python-pet,United States,National (US),0.8126,Q6_Welfare
Google Search,"how to take care of a burmese python wild caught burmese pythons typically do not make good pets, as they retain a defensive nature & are much more prone to biting than their captive bred ...",2026-02-13,pet burmese python,Reptile,https://newenglandreptilestore.com/pages/burmese-python-faqs-care,United States,National (US),0.2249,Q6_Welfare
Google Search,reptile ownership laws by state there is no permit required to possess these as a personal pet: nonvenomous and unprotected reptiles or amphibians. personal pet permits are only issued for ...,2026-02-13,pet burmese python,Reptile,https://usark.org/reptile-ownership-laws-by-state/,United States,National (US),-0.5719,Q4_Legal
Google Search,"what kind of person would own a burmese python as a pet? although i've kept the larger species of pythons (burmese & reticulated) over the years, i wouldn't really recommend them as a 'family' snake.",2026-02-13,pet burmese python,Reptile,https://www.quora.com/What-kind-of-person-would-own-a-Burmese-python-as-a-pet,United States,National (US),-0.3241,
